{
  "schema": 1,
  "kind": "cumulative-accepted-invariant-ledger",
  "ledgerId": "lifecycle-zero-model-domain-fixture-calibration-v3-2026-07-27-ledger-02",
  "runId": "lifecycle-zero-model-domain-fixture-calibration-v3-2026-07-27",
  "protocolCanonicalSha256": "1ad22aa460102e4d8e47bedcc5328e5507f11973399a20117c197561e65a23df",
  "sourceRegistryCanonicalSha256": "3097e52b038d7c7cd1f7b887c61ec59cff8954d19771ec1edb8310e5d2459535",
  "asOfStageId": "SE-TS-02-architecture-design",
  "asOfSequence": 2,
  "previousLedgerSha256": "0beec7b27929a3ae3efe1d179f35e2020c3cceddd8af547a9d9616f9e87472b0",
  "activeInvariants": [
    {
      "invariantId": "inv.source-goal",
      "version": 1,
      "status": "active",
      "claim": {
        "goalRemainsSourceBound": true
      },
      "claimCanonicalSha256": "7f69318dfdff48dd2100f55501971932d4c62a85febcb6bfd0954a8a85f6515d",
      "weight": 1,
      "sourcePointers": [
        {
          "artifactId": "SOURCE-BUNDLE",
          "artifactCanonicalSha256": "3097e52b038d7c7cd1f7b887c61ec59cff8954d19771ec1edb8310e5d2459535",
          "jsonPointer": "/acceptedInvariants"
        }
      ],
      "firstAcceptedSequence": 1,
      "lastChangedSequence": 1,
      "currentAcceptanceBasis": {
        "kind": "source",
        "bindingSha256": "3097e52b038d7c7cd1f7b887c61ec59cff8954d19771ec1edb8310e5d2459535"
      }
    },
    {
      "invariantId": "inv.no-live-side-effects",
      "version": 1,
      "status": "active",
      "claim": {
        "liveSideEffectsAuthorized": false
      },
      "claimCanonicalSha256": "1f928033dd2b5e7466f9f8988a981a4a48f03cd6a4c00b6046b4737374361ed0",
      "weight": 1,
      "sourcePointers": [
        {
          "artifactId": "SOURCE-BUNDLE",
          "artifactCanonicalSha256": "3097e52b038d7c7cd1f7b887c61ec59cff8954d19771ec1edb8310e5d2459535",
          "jsonPointer": "/acceptedInvariants"
        }
      ],
      "firstAcceptedSequence": 1,
      "lastChangedSequence": 1,
      "currentAcceptanceBasis": {
        "kind": "source",
        "bindingSha256": "3097e52b038d7c7cd1f7b887c61ec59cff8954d19771ec1edb8310e5d2459535"
      }
    },
    {
      "invariantId": "inv.stage-1-accepted",
      "version": 1,
      "status": "active",
      "claim": {
        "stageId": "SE-TS-01-requirements-domain",
        "acceptedForSyntheticCalibration": true
      },
      "claimCanonicalSha256": "21eb09370e75a9cb0ba945a15cfbfe01bf8bdaae388c24e1f7a90693c63d3a71",
      "weight": 1,
      "sourcePointers": [],
      "firstAcceptedSequence": 1,
      "lastChangedSequence": 1,
      "currentAcceptanceBasis": {
        "kind": "human-authority-receipt",
        "bindingSha256": "494bf1bcb68d0d82208f74810aae600e85fd40eb73fda0516925284c7aa17a7d"
      }
    },
    {
      "invariantId": "inv.stage-2-accepted",
      "version": 1,
      "status": "active",
      "claim": {
        "stageId": "SE-TS-02-architecture-design",
        "acceptedForSyntheticCalibration": true
      },
      "claimCanonicalSha256": "11fd47ff6f904983acd202b9d6ca611e8d296151ab0e4ad035f8d9e769fe936a",
      "weight": 1,
      "sourcePointers": [],
      "firstAcceptedSequence": 2,
      "lastChangedSequence": 2,
      "currentAcceptanceBasis": {
        "kind": "human-authority-receipt",
        "bindingSha256": "8376fecd611b37b4548fd5b8da12adfb6690dc71eb04355fc3003802efe3842d"
      }
    }
  ],
  "retiredInvariantIds": [],
  "transitionHistory": [
    {
      "transitionId": "source-add-inv.source-goal",
      "stageId": "SOURCE",
      "sequence": 1,
      "beforeLedgerSha256": null,
      "proposalArtifactCanonicalSha256": "3097e52b038d7c7cd1f7b887c61ec59cff8954d19771ec1edb8310e5d2459535",
      "decision": "accepted-source-change",
      "changes": [
        {
          "changeId": "source-add-inv.source-goal",
          "operation": "add",
          "invariantId": "inv.source-goal",
          "beforeVersion": null,
          "afterVersion": 1,
          "beforeClaimCanonicalSha256": null,
          "afterClaimCanonicalSha256": "7f69318dfdff48dd2100f55501971932d4c62a85febcb6bfd0954a8a85f6515d",
          "basis": {
            "kind": "source",
            "bindingSha256": "3097e52b038d7c7cd1f7b887c61ec59cff8954d19771ec1edb8310e5d2459535"
          }
        }
      ],
      "transitionCanonicalSha256": "308189454ef0c8f59dc62f1eacc7fb7e21cc14160e0c93dc4c9e438b126267cc"
    },
    {
      "transitionId": "source-add-inv.no-live-side-effects",
      "stageId": "SOURCE",
      "sequence": 1,
      "beforeLedgerSha256": null,
      "proposalArtifactCanonicalSha256": "3097e52b038d7c7cd1f7b887c61ec59cff8954d19771ec1edb8310e5d2459535",
      "decision": "accepted-source-change",
      "changes": [
        {
          "changeId": "source-add-inv.no-live-side-effects",
          "operation": "add",
          "invariantId": "inv.no-live-side-effects",
          "beforeVersion": null,
          "afterVersion": 1,
          "beforeClaimCanonicalSha256": null,
          "afterClaimCanonicalSha256": "1f928033dd2b5e7466f9f8988a981a4a48f03cd6a4c00b6046b4737374361ed0",
          "basis": {
            "kind": "source",
            "bindingSha256": "3097e52b038d7c7cd1f7b887c61ec59cff8954d19771ec1edb8310e5d2459535"
          }
        }
      ],
      "transitionCanonicalSha256": "9f5811bb8ac2fe3778e05cbc59503e6cda1ffe1ef2d9d9f778c8f55a9c950bf1"
    },
    {
      "transitionId": "accept-stage-1",
      "stageId": "SE-TS-01-requirements-domain",
      "sequence": 1,
      "beforeLedgerSha256": "9adf674eec51383596c3233b67785a762542ce33c8ca428674a331b23b625ad2",
      "proposalArtifactCanonicalSha256": "ccfe00e98359b188caa0cfd79b4e5e8a4339d305e39ffde70824992543edb79c",
      "decision": "accepted-human-authority-change",
      "changes": [
        {
          "changeId": "accept-stage-1",
          "operation": "add",
          "invariantId": "inv.stage-1-accepted",
          "beforeVersion": null,
          "afterVersion": 1,
          "beforeClaimCanonicalSha256": null,
          "afterClaimCanonicalSha256": "21eb09370e75a9cb0ba945a15cfbfe01bf8bdaae388c24e1f7a90693c63d3a71",
          "basis": {
            "kind": "human-authority-receipt",
            "bindingSha256": "494bf1bcb68d0d82208f74810aae600e85fd40eb73fda0516925284c7aa17a7d"
          }
        }
      ],
      "transitionCanonicalSha256": "25cc821bc208e425a76ce9bcf2306002f06621ac9847243334ac38f966a1ead3"
    },
    {
      "transitionId": "accept-stage-2",
      "stageId": "SE-TS-02-architecture-design",
      "sequence": 2,
      "beforeLedgerSha256": "0beec7b27929a3ae3efe1d179f35e2020c3cceddd8af547a9d9616f9e87472b0",
      "proposalArtifactCanonicalSha256": "7210e50f43e8214ba083ca1d52f8619911a663c0d7a3612e40e40ad21f30bba1",
      "decision": "accepted-human-authority-change",
      "changes": [
        {
          "changeId": "accept-stage-2",
          "operation": "add",
          "invariantId": "inv.stage-2-accepted",
          "beforeVersion": null,
          "afterVersion": 1,
          "beforeClaimCanonicalSha256": null,
          "afterClaimCanonicalSha256": "11fd47ff6f904983acd202b9d6ca611e8d296151ab0e4ad035f8d9e769fe936a",
          "basis": {
            "kind": "human-authority-receipt",
            "bindingSha256": "8376fecd611b37b4548fd5b8da12adfb6690dc71eb04355fc3003802efe3842d"
          }
        }
      ],
      "transitionCanonicalSha256": "4f44e6ad0a99f5a4b457a675d2d6dcdff77866e8314609dc3ee5c95c7c1ee19d"
    }
  ],
  "summary": {
    "activeInvariantCount": 4,
    "retiredInvariantCount": 0,
    "acceptedChangeCount": 4,
    "sourceBackedChangeCount": 2,
    "humanReceiptBackedChangeCount": 2
  },
  "producer": "parent-evaluator",
  "ledgerSha256": "630ca2def1e7ba4d9b658950246553514d91965ea6409369b046847cca693d68"
}
